{
  "formato": 1,
  "id": "mani-tostado",
  "tipo": "simple",
  "estado": "se_vende",
  "nombre_producto": "Maní tostado",
  "descripcion": ["MANÍ TOSTADO", "SIN SAL"],
  "destacado": ["TOSTADO, NO FRITO"],
  "color_aro": "#7A4A1E",
  "presentaciones": [
    { "peso_neto_g": 100, "envase": "sobre_chico", "codigo_barras": "2000000000008", "origen_codigo": "propio" }
  ],
  "composicion": {
    "ingredientes": "{maní}",
    "nombre_como_ingrediente": "maní",
    "contiene": ["mani"],
    "puede_contener": ["frutos_cascara", "soya", "sesamo"],
    "anadidos": [],
    "pais_origen": "Chile",
    "con_cascara": false,
    "conservacion": null,
    "instrucciones_uso": null,
    "texto_adicional": null,
    "duracion_proveedor": { "cantidad": 12, "unidad": "meses" },
    "fuente": "demo"
  },
  "nutricion": {
    "porcion": { "g": 30, "medida_casera": "¼ taza", "fuente": "demo" },
    "por_100g": {
      "energia_kcal": { "valor": 590, "fuente": "demo" },
      "proteinas_g": { "valor": 25, "fuente": "demo" },
      "grasas_totales_g": { "valor": 49, "fuente": "demo" },
      "grasas_saturadas_g": { "valor": 7, "fuente": "demo" },
      "grasas_monoinsaturadas_g": { "valor": 24, "fuente": "demo" },
      "grasas_poliinsaturadas_g": { "valor": 15, "fuente": "demo" },
      "grasas_trans_g": { "valor": 0, "fuente": "demo" },
      "colesterol_mg": { "valor": 0, "fuente": "demo" },
      "hidratos_carbono_disponibles_g": { "valor": 14, "fuente": "demo" },
      "azucares_totales_g": { "valor": 5, "fuente": "demo" },
      "fibra_dietetica_g": { "valor": 8, "fuente": "demo" },
      "sodio_mg": { "valor": 5, "fuente": "demo" }
    }
  },
  "fuentes": [
    { "id": "demo", "nivel": 1, "tipo": "manual", "origen": "Proveedor ficticio", "fecha": "2026-10-27", "nota": "Valores de ejemplo, no son de un producto real." }
  ]
}
